[
  {
    "clause_id": "ollama-llama3.1-0001",
    "text": "ब्याज हर महीने ५% की दर से बढ़ता रहेगा।",
    "language": "hi",
    "doc_type": "loan_chit",
    "clause_category": "interest_finance_terms",
    "risk_label": "low",
    "related_provision_ids": [],
    "source": "synthetic_llm_generated",
    "notes": "Generated locally via Ollama/llama3.1. NOT human-reviewed yet - do the roadmap's human spot-check pass before trusting this for training."
  },
  {
    "clause_id": "ollama-llama3.1-0002",
    "text": "The lessee will pay 5,000 rupees each quarter, with 2 installments of 2,000 rupees and 3 installments of 1,000 rupees, starting from 15th April.",
    "language": "en",
    "doc_type": "land_lease",
    "clause_category": "principal_repayment_schedule",
    "risk_label": "medium",
    "related_provision_ids": [],
    "source": "synthetic_llm_generated",
    "notes": "Generated locally via Ollama/llama3.1. NOT human-reviewed yet - do the roadmap's human spot-check pass before trusting this for training."
  },
  {
    "clause_id": "ollama-llama3.1-0003",
    "text": "जो मजदूर एक महीने में दो बार देरी से आता है, उसे १०० रुपये का नुकसान देना होगा।",
    "language": "hi",
    "doc_type": "labor_contract",
    "clause_category": "penalty_default_consequences",
    "risk_label": "high",
    "related_provision_ids": [],
    "source": "synthetic_llm_generated",
    "notes": "Generated locally via Ollama/llama3.1. NOT human-reviewed yet - do the roadmap's human spot-check pass before trusting this for training."
  },
  {
    "clause_id": "ollama-llama3.1-0004",
    "text": "The loan will be repaid over a period of 24 months.",
    "language": "en",
    "doc_type": "loan_chit",
    "clause_category": "duration_term",
    "risk_label": "low",
    "related_provision_ids": [],
    "source": "synthetic_llm_generated",
    "notes": "Generated locally via Ollama/llama3.1. NOT human-reviewed yet - do the roadmap's human spot-check pass before trusting this for training."
  },
  {
    "clause_id": "ollama-llama3.1-0005",
    "text": "अगर हमें लगता है कि आप किराए का भुगतान नहीं कर रहे हैं, तो हमें ३ महीने का नोटिस देने की अनुमति होगी।",
    "language": "hi",
    "doc_type": "land_lease",
    "clause_category": "termination_notice_period",
    "risk_label": "medium",
    "related_provision_ids": [],
    "source": "synthetic_llm_generated",
    "notes": "Generated locally via Ollama/llama3.1. NOT human-reviewed yet - do the roadmap's human spot-check pass before trusting this for training."
  },
  {
    "clause_id": "ollama-llama3.1-0006",
    "text": "Payment of wages will be made only 15 days after completion of work.",
    "language": "en",
    "doc_type": "labor_contract",
    "clause_category": "wage_payment_terms",
    "risk_label": "high",
    "related_provision_ids": [],
    "source": "synthetic_llm_generated",
    "notes": "Generated locally via Ollama/llama3.1. NOT human-reviewed yet - do the roadmap's human spot-check pass before trusting this for training."
  },
  {
    "clause_id": "ollama-llama3.1-0007",
    "text": "काम का समय सुबह ८ बजे से शाम ५ बजे तक होगा, दो घंटे का फ्रेशर होगा।",
    "language": "hi",
    "doc_type": "loan_chit",
    "clause_category": "working_hours_conditions",
    "risk_label": "low",
    "related_provision_ids": [],
    "source": "synthetic_llm_generated",
    "notes": "Generated locally via Ollama/llama3.1. NOT human-reviewed yet - do the roadmap's human spot-check pass before trusting this for training."
  },
  {
    "clause_id": "ollama-llama3.1-0008",
    "text": "The lessee will have the option to buy the land at a price of 50,000 rupees in 2 years, if they fulfill all the lease terms.",
    "language": "en",
    "doc_type": "land_lease",
    "clause_category": "ownership_transfer",
    "risk_label": "medium",
    "related_provision_ids": [],
    "source": "synthetic_llm_generated",
    "notes": "Generated locally via Ollama/llama3.1. NOT human-reviewed yet - do the roadmap's human spot-check pass before trusting this for training."
  },
  {
    "clause_id": "ollama-llama3.1-0009",
    "text": "अगर हमें वेतन देने में असमर्थता हो तो हमारा मकान और जमीन हमारे कर्ज चुकाने के लिए बेच सकते हैं।",
    "language": "hi",
    "doc_type": "labor_contract",
    "clause_category": "security_collateral_pledge",
    "risk_label": "high",
    "related_provision_ids": [],
    "source": "synthetic_llm_generated",
    "notes": "Generated locally via Ollama/llama3.1. NOT human-reviewed yet - do the roadmap's human spot-check pass before trusting this for training."
  },
  {
    "clause_id": "ollama-llama3.1-0010",
    "text": "The borrower will provide ID proof and address proof at the time of loan disbursement.",
    "language": "en",
    "doc_type": "loan_chit",
    "clause_category": "mandatory_disclosure_documentation",
    "risk_label": "low",
    "related_provision_ids": [],
    "source": "synthetic_llm_generated",
    "notes": "Generated locally via Ollama/llama3.1. NOT human-reviewed yet - do the roadmap's human spot-check pass before trusting this for training."
  },
  {
    "clause_id": "ollama-llama3.1-0011",
    "text": "अगर कोई विवाद होता है तो दोनों पक्ष मिलकर पंचायत के फैसले का पालन करेंगे।",
    "language": "hi",
    "doc_type": "land_lease",
    "clause_category": "dispute_resolution",
    "risk_label": "medium",
    "related_provision_ids": [],
    "source": "synthetic_llm_generated",
    "notes": "Generated locally via Ollama/llama3.1. NOT human-reviewed yet - do the roadmap's human spot-check pass before trusting this for training."
  },
  {
    "clause_id": "ollama-llama3.1-0012",
    "text": "This contract will automatically renew for another year unless either party gives 30 days' written notice.",
    "language": "en",
    "doc_type": "labor_contract",
    "clause_category": "renewal_auto_renewal",
    "risk_label": "high",
    "related_provision_ids": [],
    "source": "synthetic_llm_generated",
    "notes": "Generated locally via Ollama/llama3.1. NOT human-reviewed yet - do the roadmap's human spot-check pass before trusting this for training."
  },
  {
    "clause_id": "ollama-llama3.1-0013",
    "text": "ब्याज वाली रकम को समय पर चुकता करने के बाद, हमारी चिट को पूरी तरह से खत्म माना जाएगा।",
    "language": "hi",
    "doc_type": "loan_chit",
    "clause_category": "other_uncategorized",
    "risk_label": "low",
    "related_provision_ids": [],
    "source": "synthetic_llm_generated",
    "notes": "Generated locally via Ollama/llama3.1. NOT human-reviewed yet - do the roadmap's human spot-check pass before trusting this for training."
  },
  {
    "clause_id": "ollama-llama3.1-0014",
    "text": "The leasee will pay 8% annual interest on the initial 5000 rupees, plus 5% on any borrowed amount.",
    "language": "en",
    "doc_type": "land_lease",
    "clause_category": "interest_finance_terms",
    "risk_label": "medium",
    "related_provision_ids": [],
    "source": "synthetic_llm_generated",
    "notes": "Generated locally via Ollama/llama3.1. NOT human-reviewed yet - do the roadmap's human spot-check pass before trusting this for training."
  },
  {
    "clause_id": "ollama-llama3.1-0015",
    "text": "कर्मचारी हर दो महीने में 1,500 रुपये का निश्चित भुगतान करेगा, जो उसके वेतन से काट लिया जाएगा।",
    "language": "hi",
    "doc_type": "labor_contract",
    "clause_category": "principal_repayment_schedule",
    "risk_label": "high",
    "related_provision_ids": [],
    "source": "synthetic_llm_generated",
    "notes": "Generated locally via Ollama/llama3.1. NOT human-reviewed yet - do the roadmap's human spot-check pass before trusting this for training."
  },
  {
    "clause_id": "ollama-llama3.1-0016",
    "text": "If we miss any repayment, we will pay a small fine of 100 rupees.",
    "language": "en",
    "doc_type": "loan_chit",
    "clause_category": "penalty_default_consequences",
    "risk_label": "low",
    "related_provision_ids": [],
    "source": "synthetic_llm_generated",
    "notes": "Generated locally via Ollama/llama3.1. NOT human-reviewed yet - do the roadmap's human spot-check pass before trusting this for training."
  },
  {
    "clause_id": "ollama-llama3.1-0017",
    "text": "भूमि किराए पर 3 साल के लिए ली जाएगी, बाद में किराया बढ़ाया जा सकता है, परन्तु पहले 3 साल के लिए ५००० रुपये का निर्धारित किराया रहेगा।",
    "language": "hi",
    "doc_type": "land_lease",
    "clause_category": "duration_term",
    "risk_label": "medium",
    "related_provision_ids": [],
    "source": "synthetic_llm_generated",
    "notes": "Generated locally via Ollama/llama3.1. NOT human-reviewed yet - do the roadmap's human spot-check pass before trusting this for training."
  },
  {
    "clause_id": "ollama-llama3.1-0018",
    "text": "If employer wants to terminate this contract, they have to give at least six months notice to worker.",
    "language": "en",
    "doc_type": "labor_contract",
    "clause_category": "termination_notice_period",
    "risk_label": "high",
    "related_provision_ids": [],
    "source": "synthetic_llm_generated",
    "notes": "Generated locally via Ollama/llama3.1. NOT human-reviewed yet - do the roadmap's human spot-check pass before trusting this for training."
  },
  {
    "clause_id": "ollama-llama3.1-0019",
    "text": "वेतन हर दिन को पहले से चुकाया जाएगा, सिर्फ एक छोटी सी कार्य लागत भी कुछ भी हो सकती है।",
    "language": "hi",
    "doc_type": "loan_chit",
    "clause_category": "wage_payment_terms",
    "risk_label": "low",
    "related_provision_ids": [],
    "source": "synthetic_llm_generated",
    "notes": "Generated locally via Ollama/llama3.1. NOT human-reviewed yet - do the roadmap's human spot-check pass before trusting this for training."
  },
  {
    "clause_id": "ollama-llama3.1-0020",
    "text": "The tenant will not work more than 10 hours a day, six days a week.",
    "language": "en",
    "doc_type": "land_lease",
    "clause_category": "working_hours_conditions",
    "risk_label": "medium",
    "related_provision_ids": [],